symbol,publishedDate,title,image,site,text,url,title_compound,text_compound
AAL,2020-04-14,Nearly a dozen airlines agree to take government aid,https://cdn.snapi.dev/images/v1/m/q/nearly-a-dozen-airlines-agree-to-take-government-aid.jpg,CNBC Television,CNBC's Phil LeBeau reports on airlines agreeing to take aid in order to keep employees on the payroll.,https://www.youtube.com/watch?v=DC9KG6I5D5M,0.3612,0.34
AAL,2020-04-14,Major U.S. airlines accept government aid for payrolls; American also wants a loan,https://cdn.snapi.dev/images/v1/a/i/ai8-5.jpg,Reuters,"The U.S. Treasury Department said on Tuesday that major passenger airlines have agreed in principle to a $25 billion rescue package, ensuring airline workers jobs until October while the industry works to overcome its biggest-ever crisis.",https://www.reuters.com/article/us-health-coronavirus-usa-airlines/major-u-s-airlines-accept-government-aid-for-payrolls-american-also-wants-a-loan-idUSKCN21W2XA,0.3818,0.4939
AAL,2020-04-14,Treasury and Airlines Agree on Terms of Industry Bailout,https://cdn.snapi.dev/images/v1/g/s/merlin-171536769-39332684-d3ca-4378-990b-138a5f433153-articlelargejpgquality75autowebpdisableupscale.jpg,NYTimes,"Airlines will receive billions of dollars in grants and loans to pay flight attendants, pilots and other employees.",https://www.nytimes.com/2020/04/14/business/coronavirus-airlines-bailout-treasury-department.html,0.4404,0.128
AAL,2020-04-14,"White House, major airlines reach terms for $25B bailout",https://cdn.snapi.dev/images/v1/9/z/airline-bailoutjpgquality90stripall.jpg,New York Post,"The funds, approved last month by Congress as part of a more than $2 trillion stimulus bill, will be distributed to companies that agree not to furlough workers before Oct. 1.",https://nypost.com/2020/04/14/white-house-major-airlines-reach-terms-for-25b-bailout/,-0.0772,0.6486
AAL,2020-04-14,"US airlines agree to accept stimulus funds, Treasury Department says",https://cdn.snapi.dev/images/v1/t/y/190926103627-united-airlines-planes-tarmac-sfo-super-169.jpg,CNN Business,"Major US airlines have accepted the government's terms to receive billions of aid and keep hundreds of thousands of employees on the payrolls, the Treasury Department announced Tuesday.",https://www.cnn.com/2020/04/14/politics/airlines-payroll-aid/index.html,0.7096,0.4404
AAL,2020-04-14,"Treasury, airlines reach agreement in principle on aid",https://cdn.snapi.dev/images/v1/h/v/treasury-airlines-reach-agreement-in-principle-on-aid.jpg,CNBC Television,CNBC's Phil LeBeau reports that the Treasury department has reached an agreement with the airlines to help them out during the coronavirus pandemic.,https://www.youtube.com/watch?v=jtMPBXbV9ok,0.6249,0.7964
AAL,2020-04-14,"US airlines, Treasury Department reach agreement in principle on aid",https://cdn.snapi.dev/images/v1/r/v/106476899-1586194289560gettyimages-1209295523.jpeg,CNBC,"U.S. airlines and the Treasury Department have reached an agreement in principle on billions in government aid aimed at softening the blow from the coronavirus, sources told CNBC.",https://www.cnbc.com/2020/04/14/coronavirus-aid-us-airlines-treasury-department-reach-agreement-in-principle-on-aid.html,0.6249,0.6597
AAL,2020-04-14,"U.S. Treasury, airlines reach agreement in principle on payroll aid -sources",https://cdn.snapi.dev/images/v1/b/s/m02d20200414t2i1515076617rlynxnpeg3d228w640.jpg,Reuters,"The U.S. Treasury Department and passenger airlines have reached an agreement in principle on a $25 billion payroll support package meant to help airlines weather the economic impact of the coronavirus on travel demand, sources with knowledge of the matter said on Tuesday.",https://www.reuters.com/article/us-health-coronavirus-usa-airlines/u-s-treasury-airlines-reach-agreement-in-principle-on-payroll-aid-sources-idUSKCN21W2XA,0.6249,0.8555
AAL,2020-04-14,Airlines face 2020 revenue loss of $314B,https://cdn.snapi.dev/images/v1/m/q/airlines-face-2020-revenue-loss-of-314b.jpg,CNBC Television,"Brandon Oglenski, Barclays analyst, on the immense pressure airlines are facing and why some are close to accepting the terms of the government's payroll plan.",https://www.youtube.com/watch?v=5NyRYb6b0rM,-0.3182,0.1027
AAL,2020-04-14,Airline Industry to See $314 Billion in Lost 2020 Ticket Sales: IATA,https://cdn.snapi.dev/images/v1/m/0/m02d20200331t2i1510566545rlynxmpeg2u16uw640-2.jpg,Bloomberg Markets and Finance,"We are approaching our worst scenario,” says International Air Transport Association Director-General Alexandre de Juniac, as the airline industry may lose 25% more in ticket sales than previously expected in 2020. He speaks on ""Bloomberg Markets: European Close.""",https://www.youtube.com/watch?v=UeqfJvzeowc,-0.3182,-0.7783
AAL,2020-04-14,Here's How Much Each Big Airline Could Get In Coronavirus Bailout,https://cdn.snapi.dev/images/v1/a/x/airline7-2.jpg,Investors Business Daily,Airline stocks rose on signs that the big U.S. carriers could soon announce how much coronavirus-relief aid they'll get from the government.,https://www.investors.com/news/airline-stocks-rise-investors-await-imminent-bailout-rescue-aid-figures/,-0.1027,0.0
AAL,2020-04-14,Airlines Begin Pulling Passenger Seats To Make Room For Cargo,https://cdn.snapi.dev/images/v1/a/i/airlines-pulling-passenger-seats-1.jpg,Benzinga,"With a global shortage of air cargo space and extraordinary demand to move emergency medical supplies, some overseas passenger airlines are taking out the seats on aircraft to make more room for freight.",https://www.benzinga.com/news/20/04/15797218/airlines-begin-pulling-passenger-seats-to-make-room-for-cargo,0.0,-0.6249
AAL,2020-04-14,Global airline hit from coronavirus rises to $314 billion: IATA,https://cdn.snapi.dev/images/v1/u/3/m02d20200414t2i1515018251rlynxnpeg3d14zw640.jpg,Reuters,"Global airlines will lose $314 billion in revenue due to the coronavirus pandemic in 2020 according to a forecast from the industry's representative body IATA, which raised its estimate from the $252 billion figure given on March 24.",https://www.reuters.com/article/us-health-coronavirus-iata/global-airline-hit-from-coronavirus-rises-to-314-billion-iata-idUSKCN21W1LN,0.0,-0.4019
AAL,2020-04-14,3 Reasons to Think Twice Before Investing in American Airlines Stock,https://cdn.snapi.dev/images/v1/e/o/airline10.jpg,InvestorPlace,"While air travel could begin improving in the coming months, it will still take a long time to recover from the pandemic. It's best to avoid AAL stock for the time being.",https://investorplace.com/2020/04/3-reasons-to-think-twice-before-investing-in-american-airlines-stock/,0.0,0.7003
AAL,2020-04-13,American Airlines: Treasury Throws Curve Ball,https://cdn.snapi.dev/images/v1/d/t/106438030-1583990898614gettyimages-1210980374.jpeg,Seeking Alpha,American Airlines: Treasury Throws Curve Ball,https://seekingalpha.com/article/4337415-american-airlines-treasury-throws-curve-ball,0.2023,0.2023
AAL,2020-04-13,Some U.S. airlines nearing acceptance of payroll aid plan -sources,https://cdn.snapi.dev/images/v1/b/h/urlhttps3a2f2fgfoolcdncom2feditorial2fimages2f5619772f3-d-rendering-of-scary-looking-viruses-on-a-red-backgroundjpgw700opresize.jpg,Reuters,"Some large U.S. passenger airlines are close to accepting the terms of a $25 billion offer for government coronavirus payroll aid, with announcements possible as early as Tuesday, people briefed on the matter said.",https://www.reuters.com/article/us-health-coronavirus-usa-airlines/some-u-s-airlines-nearing-acceptance-of-payroll-aid-plan-sources-idUSKCN21V1VO,0.4588,0.4019
AAL,2020-04-13,"U.S. government holding firm on airline aid plan, could end up with 3% of American Airlines",https://cdn.snapi.dev/images/v1/n/h/m02d20200413t2i1514928419rlynxnpeg3c1f4w640.jpg,Reuters,"The U.S. Treasury Department is holding firm on the terms of a $25 billion offer for government aid to airlines to help them meet payroll during the coronavirus downturn, officials said on Monday, and the plan could give the government more than 3% of American Airlines Group Inc.",https://www.reuters.com/article/us-health-coronavirus-usa-airlines/u-s-government-holding-firm-on-airline-aid-plan-could-end-up-with-3-of-american-airlines-idUSKCN21V1VO,0.0,0.5423
AAL,2020-04-13,How Bulls and Bears Can Trade American Airlines Stock Now,https://cdn.snapi.dev/images/v1/z/4/urlhttps3a2f2fgfoolcdncom2feditorial2fimages2f5666282fairline-american-airlines-787-dreamliner-aal-bajpgw700opresize.jpg,InvestorPlace,American Airlines stock is trying to bottom. Here are the price levels that matter and how bulls and bears should trade it moving forward.,https://investorplace.com/2020/04/how-to-trade-american-airlines-stock-just-yet/,0.0,0.0258
AAL,2020-04-13,Mnuchin flexes muscles on airline coronavirus aid — a taste of what other companies may face,https://cdn.snapi.dev/images/v1/g/w/106485791-1586779231774gettyimages-1218447685.jpeg,CNBC,Treasury Department requests to airlines for coronavirus aid are a preview of what's to come for other industries.,https://www.cnbc.com/2020/04/13/coronavirus-aid-mnuchin-flexes-muscles-over-airline-grants-a-taste-of-what-other-companies-face.html,0.0,0.2023
AAL,2020-04-13,Why Airline Shares Are Falling  Today,https://cdn.snapi.dev/images/v1/o/g/urlhttps3a2f2fgfoolcdncom2feditorial2fimages2f5677772fairplane-airport-source-gettyjpgw700opresize.jpg,The Motley Fool,Bailout funds will be harder to obtain than investors had hoped.,https://www.fool.com/investing/2020/04/13/why-airline-shares-are-falling-today.aspx,0.1531,0.296
AAL,2020-04-13,It’s Time to Disembark from American Airlines Stock,https://cdn.snapi.dev/images/v1/3/x/airline2.jpg,InvestorPlace,"Recent momentum may convince you to think positively about AAL stock. Unfortunately, this is nothing more than a trap as the fundamentals are incredibly poor.",https://investorplace.com/2020/04/its-time-to-disembark-from-american-airlines-stock/,0.0,0.1962
AAL,2020-04-13,American Airlines Stock Is Only Worth Buying If You Believe in a Comeback,https://cdn.snapi.dev/images/v1/g/g/200327081937-01-american-airlines-stored-aircraft-tulsa-super-169.jpg,InvestorPlace,"American Airlines trades at multi-year lows as investors brace for heavy losses in the near term. If conditions improve, AAL stock will rise.",https://investorplace.com/2020/04/american-airlines-aal-stock-only-worth-buying-comeback/,0.2263,-0.1531
AAL,2020-04-13,One-Third of American Airlines Pilots and Flight Attendants Are Taking Leave or Early Retirement,https://cdn.snapi.dev/images/v1/u/r/urlhttps3a2f2fgfoolcdncom2feditorial2fimages2f5677502faal-tail-source-aaljpgw700opresize.jpg,The Motley Fool,American seems certain to come out of this crisis a much smaller airline.,https://www.fool.com/investing/2020/04/13/one-third-of-american-airlines-pilots-and-flight-a.aspx,-0.0516,-0.5824
AAL,2020-04-13,Airlines want U.S. Treasury to scrap proposal to make some grant money repayable,https://cdn.snapi.dev/images/v1/z/k/gettyimages-1185482853jpgw600-2.jpg,Reuters,Major U.S. airlines were urging Treasury officials and the federal government's outside advisers on Saturday to scrap or revise a proposal that would make part of the $25 billion earmarked by Congress to help keep workers on the payroll repayable in the form of low-cost loans.,https://www.reuters.com/article/us-health-coronavirus-usa-airlines/airlines-want-u-s-treasury-to-scrap-proposal-to-make-some-grant-money-repayable-idUSKCN21T0X0,0.5574,0.5423
AAL,2020-04-13,'This will lead to airline bankruptcies' — flight attendant union furious with Treasury bailout offers,https://cdn.snapi.dev/images/v1/9/6/100588358-us-airways-american-airlines-gettyp.jpg,CNBC,"Less than 24 hours after the Treasury Department formally extended cash grant offers to the six largest airlines in the U.S., the union representing 120,000 flight attendants is blasting the move with a dire warning.",https://www.cnbc.com/2020/04/11/flight-attendant-union-furious-with-treasury-bailout-offers.html,-0.5106,-0.2732
AAL,2020-04-13,Airline cash grants offered by federal government could force carriers to take on more debt,https://cdn.snapi.dev/images/v1/1/0/106468386-1585659984618gettyimages-1208433238.jpeg,CNBC,"Two weeks after Congress approved a $50 Billion bailout of airlines that earmarked carriers receiving $25 Billion in direct cash grants, it turns out those grants could require airlines to take on more debt.",https://www.cnbc.com/2020/04/11/airline-cash-grants-offered-by-federal-government-could-force-carriers-to-take-on-more-debt.html,-0.2247,0.3415
AAL,2020-04-10,Treasury Department says larger airlines need to compensate taxpayers for coronavirus aid as talks drag on,https://cdn.snapi.dev/images/v1/b/d/106434617-1583847090129gettyimages-1205294833.jpeg,CNBC,Talks for the aid have blown past a Monday deadline to disburse up to $32 billion in grants to airlines and contractors to weather coronavirus.,https://www.cnbc.com/2020/04/10/coronavirus-aid-treasury-department-says-larger-airlines-have-compensate-taxpayers.html,-0.0258,0.2263
AAL,2020-04-10,Treasury briefing U.S. airlines on $32 billion grant program: sources,https://cdn.snapi.dev/images/v1/s/d/m02d20200410t2i1514705841rlynxnpeg3919ew640.jpg,Reuters,"U.S. Treasury Secretary Steven Mnuchin is holding calls with airline CEOs throughout the day and could announce details of a $32 billion payroll grant package later this afternoon, people briefed on the matter told Reuters.",https://www.reuters.com/article/us-health-coronavirus-usa-airlines-progr/treasury-briefing-u-s-airlines-on-32-billion-grant-program-sources-idUSKCN21S1Y7,0.5106,0.5267
AAL,2020-04-10,Don’t Buy Into American Airlines’ Redemption Story Here,https://cdn.snapi.dev/images/v1/1/n/m02d20200406t2i1512931020rlynxmpeg3503dw640.jpg,InvestorPlace,"From 2014 through 2019, American spent nearly $13 billion combined on buybacks and dividends, yet here we are discussing a stock that trades at a third of the levels it did in early 2014 and is flirting with all time lows.
The post Don’t Buy Into American Airlines’ Redemption Story Here appeared first on InvestorPlace.",https://investorplace.com/2020/04/american-is-one-of-the-worst-positioned-airlines-thats-saying-something/,0.0,0.0
AAL,2020-04-09,Trump says airline bailout proposal could be unveiled this weekend,https://cdn.snapi.dev/images/v1/i/7/transportation-system-3190760-1920.jpg,Market Watch,President Donald Trump said Thursday that his administration's proposed bailout program for the airline industry may be unveiled this weekend.,https://www.marketwatch.com/story/trump-says-airline-bailout-proposal-could-be-unveiled-this-weekend-2020-04-09,-0.1027,-0.1027
AAL,2020-04-09,Trump says airlines could receive grant details this weekend as sources say around 275 applied,https://cdn.snapi.dev/images/v1/1/0/106483028-1586472440898aaa.jpg,CNBC,"President Donald Trump said on Thursday that airlines could receive details this weekend about the terms of a $32 billion payroll grant to offset the impact of the coronavirus outbreak, which sources told Reuters has received around 275 applicants.",https://www.cnbc.com/2020/04/09/trump-says-airlines-could-receive-grant-details-this-weekend-as-sources-say-around-275-applied.html,0.3612,0.3612
AAL,2020-04-09,Trump: May Give Airlines Bailout Proposal Over the Weekend,https://cdn.snapi.dev/images/v1/d/4/trump-may-give-airlines-bailout-proposal-over-the-weekend.jpg,Bloomberg Markets and Finance,President Donald Trump says he may unveil a bailout proposal for the beleaguered U.S. airline industry over the weekend. Airlines have been frustrated by delays in U.S. aid after being virtually shutdown by the coronavirus. Some of those carriers are depending on federal funds to meet payroll obligations next week and face the prospect of furloughing workers. Trump speaks at a White House briefing.,https://www.youtube.com/watch?v=i99qzVJzX8g,-0.1027,-0.3818
AAL,2020-04-09,Trump says airlines could receive grant details this weekend; sources say around 275 applied,https://cdn.snapi.dev/images/v1/m/0/m02d20200409t2i1514624272rlynxnpeg382g9w640.jpg,Reuters,"U.S. President Donald Trump said on Thursday that airlines could receive details this weekend about the terms of a $32 billion payroll grant to offset the impact of the coronavirus outbreak, which sources told Reuters has received around 275 applicants.",https://www.reuters.com/article/us-health-coronavirus-usa-airlines-mnuch/trump-says-airlines-could-receive-grant-details-this-weekend-sources-say-around-275-applied-idUSKCN21R2LK,0.3612,0.3612
AAL,2020-04-09,U.S. Treasury chief to brief Trump on aviation aid review,https://cdn.snapi.dev/images/v1/t/s/m02d20200409t2i1514617885rlynxnpeg381lxw640.jpg,Reuters,"U.S. Treasury Secretary Steve Mnuchin was due to brief President Donald Trump at the White House on Thursday about the government's review of requests for $32 billion in grants from passenger airlines, cargo carriers and airport contractors.",https://www.reuters.com/article/us-health-coronavirus-usa-airlines-mnuch/u-s-treasury-chief-to-brief-trump-on-aviation-aid-review-idUSKCN21R2LK,0.2023,0.4019
AAL,2020-04-09,Why Shares of Travel Companies Are Up Today,https://cdn.snapi.dev/images/v1/1/z/p-1-hereand8217s-how-much-united-delta-and-american-airlines-are-cutting-service-in-the-wake-of-covid-19.jpg,The Motley Fool,Hopes of an airline recovery give lift to some of the broad array of companies that rely on the industry.,https://www.fool.com/investing/2020/04/09/why-shares-of-travel-companies-are-up-today.aspx,0.296,0.4215
AAL,2020-04-09,Why Shares of Airlines Are Soaring Today,https://cdn.snapi.dev/images/v1/m/x/urlhttps3a2f2fgfoolcdncom2feditorial2fimages2f5674862fairport-security-checkpoint-rendering-gettyjpgw700opresize.jpg,The Motley Fool,The industry gets a double shot of good news concerning the stimulus package and reopening the economy.,https://www.fool.com/investing/2020/04/09/why-shares-of-airlines-are-soaring-today.aspx,0.296,0.4404
AAL,2020-04-09,"Is It Comeback Season for Hotel, Travel, Cruise and Airline Stocks?",https://cdn.snapi.dev/images/v1/4/q/stocks131-12.jpg,24/7 Wall Street,"Hotel, travel, cruise and airline stocks have been punished the worst by the coronavirus outbreak.",https://247wallst.com/investing/2020/04/09/is-it-comeback-season-for-hotel-travel-cruise-and-airline-stocks/,0.0,-0.7964
AAL,2020-04-09,Low Fuel Costs Aid American Airlines Amid Travel Demand Drop,https://cdn.snapi.dev/images/v1/a/b/airline8.jpg,Zacks Investment Research,"Capacity cut by American Airlines (AAL) due to the COVID-19 pandemic is worrisome. However, focus on cargo-only flights and low fuel costs are positives",https://www.zacks.com/stock/news/862895/low-fuel-costs-aid-american-airlines-amid-travel-demand-drop,-0.5719,-0.3612
AAL,2020-04-09,"Airlines should start hearing back about their bailout applications by Friday, Mnuchin says",https://cdn.snapi.dev/images/v1/t/d/106473451-1585916165539rts370sc.jpg,CNBC,"Major airlines last Friday, including Delta, JetBlue, American, United and Spirit, said they had applied for federal aid aimed at covering payroll.",https://www.cnbc.com/2020/04/09/mnuchin-says-hopes-to-start-giving-information-to-airlines-friday.html,-0.1027,0.5423
AAL,2020-04-09,U.S. Treasury's Mnuchin says airline aid 'next big thing' to be rolled out,https://cdn.snapi.dev/images/v1/s/e/m02d20200409t2i1514475760rlynxnpeg381bww640.jpg,Reuters,"U.S. Treasury Secretary Steven Mnuchin said on Thursday that aid for airlines will be the ""next big thing"" to be rolled out after the Federal Reserve announced new lending backstops for mid-size companies and municipal bonds.",https://www.reuters.com/article/us-health-coronavirus-usa-airlines/u-s-treasurys-mnuchin-says-airline-aid-next-big-thing-to-be-rolled-out-idUSKCN21R27X,0.0,0.2023
AAL,2020-04-08,Why Shares of Airlines and Travel Businesses Are Higher Today,https://cdn.snapi.dev/images/v1/2/0/200316064454-02-stockholm-airport-coronavirus-0316-super-170.jpg,The Motley Fool,"Economic confidence, for now anyway, is on the rise.",https://www.fool.com/investing/2020/04/08/why-shares-of-airlines-and-travel-businesses-are-h.aspx,0.296,0.5106
AAL,2020-04-08,"Exclusive: U.S. Treasury wants details on airline debt, liquidity, loyalty programs - sources",https://cdn.snapi.dev/images/v1/m/h/m02d20200408t2i1514049167rlynxmpeg371gjw640.jpg,Reuters,"U.S. Treasury officials have asked airlines seeking government payroll support to provide additional detailed information on capital structure, liquidity and loyalty programs, people briefed on the matter told Reuters.",https://www.reuters.com/article/us-health-coronavirus-airlines-usa-exclu/exclusive-u-s-treasury-wants-details-on-airline-debt-liquidity-loyalty-programs-sources-idUSKBN21Q23G,0.5106,0.7964
AAL,2020-04-08,American Airlines Stock Faces More Turbulence,https://cdn.snapi.dev/images/v1/z/g/airline5.jpg,InvestorPlace,"AAL stock may be tempting, but with challenges faced by the airline industry expected to extend beyond coronavirus, it’s a risky bet.
The post American Airlines Stock Faces More Turbulence appeared first on InvestorPlace.",https://investorplace.com/2020/04/american-airlines-stock-faces-more-turbulence/,0.0,0.0772
AAL,2020-04-07,U.S. Treasury talks continue on $25 billion in aviation grants,https://cdn.snapi.dev/images/v1/x/3/m02d20200407t2i1513579840rlynxmpeg3618uw640.jpg,Reuters,"Talks between U.S. airlines and the Treasury Department over  how to award $25 billion in cash grants earmarked for payroll assistance due to the coronavirus outbreak were set to continue into the evening Tuesday, people briefed on the matter said.",https://www.reuters.com/article/us-health-coronavirus-usa-airlines/u-s-treasury-talks-continue-on-25-billion-in-aviation-grants-idUSKBN21P1XR,0.4019,0.743
AAL,2020-04-07,American Airlines union says 100 of its flight attendants have coronavirus,https://cdn.snapi.dev/images/v1/i/x/200323120505-american-airlines-0320-super-169.jpg,CNN Business,The union representing flight attendants for American Airlines says about 100 flight attendants have tested positive for the coronavirus.,https://www.cnn.com/2020/04/07/business/american-airlines-flight-attendants-coronavirus/index.html,0.0,0.5574
AAL,2020-04-07,"Millions of aviation jobs at risk, airlines can't afford refunds: IATA",https://cdn.snapi.dev/images/v1/m/0/m02d20200407t2i1513598071rlynxmpeg361eyw640.jpg,Reuters,Global airlines warned that 25 million jobs across the world could be at risk from the coronavirus travel downturn and the industry's representative body said airline finances were so fragile they could not afford to refund customers.,https://www.reuters.com/article/us-health-coronavirus-airlines-iata/millions-of-aviation-jobs-at-risk-airlines-cant-afford-refunds-iata-idUSKBN21P1S7,-0.2732,-0.4939
AAL,2020-04-07,Department of Transportation allows airlines to cut schedules further,https://cdn.snapi.dev/images/v1/m/q/department-of-transportation-allows-airlines-to-cut-schedules-further.jpg,CNBC Television,"The Department of Transportation has given airlines final approval to pare service back to minimum flights due to plunging demand. The decision comes one day after TSA screened just 108,310 people at U.S. airports, compared to 2.38 million on the same day a year ago.",https://www.youtube.com/watch?v=euEKiWyCZ_E,-0.2732,0.3818
AAL,2020-04-06,7 Strong Value Stocks to Buy for 2020,https://cdn.snapi.dev/images/v1/f/e/value-finger-dial-768x432.jpg,InvestorPlace,Underperforming value stocks over the past decade will outperform over the next decade.,https://investorplace.com/strong-value-stocks-to-buy-for-2020/,0.6908,0.34
AAL,2020-04-06,Why Airline Shares Are Gaining Altitude Today,https://cdn.snapi.dev/images/v1/k/k/urlhttps3a2f2fgfoolcdncom2feditorial2fimages2f5669602fairport-airplanes-source-gettyjpgw700opresize.jpg,The Motley Fool,A glimmer of hope concerning the pandemic powers the stocks higher.,https://www.fool.com/investing/2020/04/06/why-airline-shares-are-gaining-altitude-today.aspx,0.6124,0.4404
AAL,2020-04-06,Commentary: Why Airlines Are Giving Freight The Window Seats,https://cdn.snapi.dev/images/v1/d/-/d-prokop-commentary-1.jpg,Benzinga,The views expressed here are solely those of the author and do not necessarily represent the views of FreightWaves or its affiliates.,https://www.benzinga.com/opinion/20/04/15750869/commentary-why-airlines-are-giving-freight-the-window-seats,0.34,0.0
AAL,2020-04-06,Flight Attendants Call For ‘A Halt To All Leisure Travel’ Amid Coronavirus,https://cdn.snapi.dev/images/v1/5/e/5e8b62012400003400a47ad9jpegops640-360.jpg,Huffington Post,At least one flight attendant died and more than 100 have tested positive for COVID-19 so far.,https://www.huffpost.com/entry/airlines-coronavirus-halt-travel_n_5e8b6084c5b6cc1e4779ab67,0.0,0.0
AAL,2020-04-06,U.S. airlines ease loyalty programs in coronavirus travel slump,https://cdn.snapi.dev/images/v1/e/7/m02d20200406t2i1513202336rlynxmpeg351mvw640.jpg,Reuters,U.S. airlines are extending loyalty program benefits and status into 2021 for members homebound because of the new coronavirus.,https://www.reuters.com/article/us-health-coronavirus-airlines-loyalty/u-s-airlines-ease-loyalty-programs-in-coronavirus-travel-slump-idUSKBN21O2CU,0.7184,0.7269
AAL,2020-04-06,Coronavirus Ravages Air Travel: Traffic Sinks to 2-Decade Low,https://cdn.snapi.dev/images/v1/w/t/airline6-2.jpg,Zacks Investment Research,"With air-travel demand drooping faster than capacity contraction in February, load factor declines in the period.",https://www.zacks.com/stock/news/857373/coronavirus-ravages-air-travel-traffic-sinks-to-2-decade-low,-0.2732,-0.128
