symbol,publishedDate,title,image,site,text,url,title_compound,text_compound
AAL,2020-02-24,"Delta, American waive cancellation fees for South Korea flights as coronavirus spreads beyond China",https://cdn.snapi.dev/images/v1/o/g/104780788-img-6983.jpg,CNBC,"It comes as the U.S. Centers for Disease Control and Prevention warned travelers to avoid non-essential travel to South Korea, where the disease has sickened close to 900 people.",https://www.cnbc.com/2020/02/25/coronavirus-delta-american-waive-change-fees-for-south-korea-flights.html,0.0,-0.7783
AAL,2020-02-24,How coronavirus fears are hurting airline stocks,https://cdn.snapi.dev/images/v1/m/q/how-coronavirus-fears-are-hurting-airline-stocks.jpg,CNBC Television,CNBC's Phil LeBeau reports on the impact airline stocks are seeing from the coronavirus outbreak.,https://www.youtube.com/watch?v=Mw0920gRR68,-0.6705,0.0
AAL,2020-02-24,Why Shares of Airlines and Vacation Operators Are Falling Today,https://cdn.snapi.dev/images/v1/k/k/urlhttps3a2f2fgfoolcdncom2feditorial2fimages2f5594942fcruise-ship-gettyjpgw700opresize.jpg,The Motley Fool,Investors are worried about the coronavirus's impact on travel companies.,https://www.fool.com/investing/2020/02/24/why-shares-of-airlines-and-vacation-operators-are.aspx,0.1531,-0.296
AAL,2020-02-24,Coronavirus market freakout: Stocks flew way too close to the sun,https://cdn.snapi.dev/images/v1/n/a/200224102058-coronavirus-beijing-0222-super-169.jpg,CNN Business,"Apple dropped a bombshell last week. Yet Wall Street, in the throes of a historic meltup, reacted with a collective shrug.",https://www.cnn.com/2020/02/24/investing/dow-stock-market-today/index.html,-0.4215,0.0
AAL,2020-02-24,Airline stocks tumble as the coronavirus spreads outside of China,https://cdn.snapi.dev/images/v1/1/0/106368388-1580568658854gettyimages-1203243557.jpeg,CNBC,Airline stocks fell more than the broader market on concerns about the spread of the coronavirus in South Korea and Italy.,https://www.cnbc.com/2020/02/24/coronavirus-airline-stocks-tumble-as-covid-19-illness-spreads-in-south-korea-italy.html,0.0,0.0
AAL,2020-02-24,Airline stocks drop as COVID-19 fears spread,https://cdn.snapi.dev/images/v1/a/i/airline2.jpg,Market Watch,"Airline stocks are taking a hit in premarket trading Monday, amid growing worries about how the global spread of COVID-19 will impact travel. Among the more-active carriers, shares of United Airlines Holdings Inc.",https://www.marketwatch.com/story/airline-stocks-drop-as-covid-19-fears-spread-2020-02-24,-0.5994,0.4404
AAL,2020-02-24,Why Is American Airlines (AAL) Down 3.4% Since Last Earnings Report?,https://cdn.snapi.dev/images/v1/5/b/airline9.jpg,Zacks Investment Research,American Airlines (AAL) reported earnings 30 days ago. What's next for the stock?,https://www.zacks.com/stock/news/778617/why-is-american-airlines-aal-down-34-since-last-earnings-report,0.0,0.0
AAL,2020-02-21,Thoughts on opportunities in defense stocks? #AskHalftime,https://cdn.snapi.dev/images/v1/m/q/thoughts-on-opportunities-in-defense-stocks-askhalftime.jpg,CNBC Television,"The ""Halftime Report"" traders answer viewer questions in #AskHalftime.",https://www.youtube.com/watch?v=v3_XqOoxfSU,0.4767,0.0
AAL,2020-02-21,Coronavirus May Slash $29.3B From Airlines' 2020 Revenues,https://cdn.snapi.dev/images/v1/t/w/airline5-2.jpg,Zacks Investment Research,The IATA forecasts $27.8-billion loss in revenues for Asia-Pacific carriers during 2020 with the majority to be borne by Chinese airlines.,https://www.zacks.com/stock/news/776853/coronavirus-may-slash-%24293b-from-airlines-2020-revenues,-0.2732,-0.3182
AAL,2020-02-20,American Airlines Group Announces Pricing of Unsecured Senior Notes,https://cdn.snapi.dev/images/v1/g/f/press6-3.jpg,GlobeNewsWire,"FORT WORTH, Texas, Feb.  20, 2020  (GLOBE NEWSWIRE) -- American Airlines Group Inc. (NASDAQ: AAL) (the “Company”) today announced that it priced $500.0 million aggregate principal amount of unsecured senior notes due 2025 (the “notes”). The notes will have an interest rate of 3.75% per annum and are being issued at a price equal to 100% of their face value. The notes will be guaranteed on a senior unsecured basis by the Company’s direct wholly-owned subsidiary, American Airlines, Inc.",https://www.globenewswire.com/news-release/2020/02/20/1988292/0/en/American-Airlines-Group-Announces-Pricing-of-Unsecured-Senior-Notes.html,-0.3818,0.4278
AAL,2020-02-20,American Airlines Group Announces Proposed Offering of Unsecured Senior Notes,https://cdn.snapi.dev/images/v1/f/g/press17.jpg,GlobeNewsWire,"FORT WORTH, Texas, Feb.  20, 2020  (GLOBE NEWSWIRE) -- American Airlines Group Inc. (the “Company”) today announced a proposed private offering of $500.0 million aggregate principal amount of unsecured senior notes due 2025.",https://www.globenewswire.com/news-release/2020/02/20/1987729/0/en/American-Airlines-Group-Announces-Proposed-Offering-of-Unsecured-Senior-Notes.html,-0.3818,0.0085
AAL,2020-02-20,Why Did Buffett Sell Shares of These 8 Stocks in the Fourth Quarter?,https://cdn.snapi.dev/images/v1/j/x/urlhttps3a2f2fgfoolcdncom2feditorial2fimages2f5583772fbuffett-brk-meeting2jpgw700opresize.jpg,The Motley Fool,Making sense of Warren Buffett's $7 billion worth of stock sales during Q4.,https://www.fool.com/investing/2020/02/20/why-did-buffett-sell-shares-of-these-8-stocks-in-t.aspx,0.296,0.2263
AAL,2020-02-18,"Airlines' Seattle turf war heats up with American, Alaska expansion–and tech workers are the prize",https://cdn.snapi.dev/images/v1/1/0/106394799-1581976977385ap-20044813256254.jpg,CNBC,The American-Alaska partnership seeks bigger share of corporate travelers from giants like Amazon and Microsoft.,https://www.cnbc.com/2020/02/18/airlines-seattle-turf-war-heats-up-with-american-alaska-partnership.html,-0.1531,0.6597
AAL,2020-02-18,There's No Doubt Anymore: Buffett Thinks Stocks Are Grossly Overvalued,https://cdn.snapi.dev/images/v1/x/o/urlhttps3a2f2fgfoolcdncom2feditorial2fimages2f5583562f16756851854-91c8a910c8-kjpgw700opresize.jpg,The Motley Fool,Berkshire Hathaway's latest 13F speaks volumes about Warren Buffett's take on the stock market and U.S. economy.,https://www.fool.com/investing/2020/02/18/theres-no-doubt-anymore-buffett-thinks-stocks-are.aspx,-0.6808,0.0
AAL,2020-02-17,American Airlines and Alaska Air Join Forces to Take On Delta,https://cdn.snapi.dev/images/v1/2/y/urlhttps3a2f2fgfoolcdncom2feditorial2fimages2f5581202fairline-american-airlines-boeing-737-aal-bajpgw700opresize.jpg,The Motley Fool,"American Airlines is weak in the Pacific Northwest, while Alaska Airlines needs a better option for serving its customers' international travel needs.",https://www.fool.com/investing/2020/02/15/american-airlines-and-alaska-air-join-forces-to-ta.aspx,0.296,0.0
AAL,2020-02-14,American Airlines joins other U.S. airlines in extending 737 Max flights halt,https://cdn.snapi.dev/images/v1/y/o/airline3.jpg,Market Watch,"American Airlines Group Inc. said Friday it expects to fly its Boeing Co.'s 737 Max aircraft on Aug. 18, joining United Airlines Holdings Inc. and Southwest Airlines Co.  in forecasting a late summer return for the grounded aircraft.",https://www.marketwatch.com/story/american-airlines-joins-other-us-airlines-in-extending-737-max-flights-halt-2020-02-14,0.0,0.4215
AAL,2020-02-14,"American removes 737 Max from schedule until Aug. 18, 2020",https://cdn.snapi.dev/images/v1/o/x/american-removes-737-max-from-schedule-until-aug-18-2020.jpg,CNBC Television,American Airlines is removing Boeing's 737 Max plains from its schedule until August 18.,https://www.youtube.com/watch?v=SUU5B3P5oSc,0.0,0.0
AAL,2020-02-14,The Coronavirus Outbreak Could Boost American Airlines' 2020 Profit,https://cdn.snapi.dev/images/v1/a/6/ameri35.jpg,Seeking Alpha,The Coronavirus Outbreak Could Boost American Airlines' 2020 Profit,https://seekingalpha.com/article/4324335-coronavirus-outbreak-boost-american-airlines-2020-profit,0.6808,0.6808
AAL,2020-02-14,"Does American Want To Fight Delta? Nah, Says American Exec.",https://cdn.snapi.dev/images/v1/d/o/does-american-want-to-fight-delta-nah-says-american-exec.jpg,Forbes,"“It’s simple in our line of work,” said American Airlines SVP Vasu Raja. “We figure out what our customers want to do.",https://www.forbes.com/sites/tedreed/2020/02/14/does-american-want-to-fight-delta--nah-says-american-exec-we-just-go-where-our-customers-want/,-0.4019,0.0772
AAL,2020-02-13,Expanded air travel alliance between Alaska and American will connect Seattle and Bangalore tech hubs,https://cdn.snapi.dev/images/v1/a/i/aircraft-exterior-aa-737-livery-left-front-top-768x575.jpg,GeekWire,Tech executives will soon have a new direct flight option from Seattle to Bangalore thanks to a West Coast alliance between Seattle-based Alaska Airlines and American Airlines.,https://www.geekwire.com/2020/expanded-alliance-alaska-american-airlines-will-connect-seattle-bangalore-tech-hubs/,0.0,0.4404
AAL,2020-02-13,American Airlines selects Seattle for first direct U.S. flight to Bangalore,https://cdn.snapi.dev/images/v1/b/q/m02d20200213t2i1489783351rlynxmpeg1c171w640.jpg,Reuters,"American Airlines Group Inc  said on Thursday it would launch its first direct U.S. flight to Bangalore from Seattle, a new route meant to meet corporate customers' demand for travel to the center of India's high-tech industry.",https://www.reuters.com/article/us-american-airline-india-alaska-air-gro/american-airlines-selects-seattle-for-first-direct-u-s-flight-to-bangalore-idUSKBN2071TN,0.0,-0.128
AAL,2020-02-13,"Alaska Airlines, American extend partnership to international flights from West Coast",https://cdn.snapi.dev/images/v1/y/b/106389136-1581598438695gettyimages-526253124.jpeg,CNBC,"Alaska, American Airlines are planning to form a partnership to sell seats on international flights from the West Coast",https://www.cnbc.com/2020/02/13/alaska-airlines-american-partner-for-international-flights-from-west-coast.html,0.1779,0.0
AAL,2020-02-13,"Alaska Airlines, American Airlines Announce New West Coast International Alliance: Alaska’s West Coast Network to Connect With American’s Long-Haul Flying to Create More Choice for Travelers",https://cdn.snapi.dev/images/v1/j/q/press12-2.jpg,GlobeNewsWire,"SEATTLE and FORT WORTH, Texas, Feb.  13, 2020  (GLOBE NEWSWIRE) -- Today, Alaska Airlines and American Airlines announce an alliance to create more choice for West Coast customers. The expanded relationship between the airlines will offer customers several benefits, including:",https://www.globenewswire.com/news-release/2020/02/13/1984566/0/en/Alaska-Airlines-American-Airlines-Announce-New-West-Coast-International-Alliance-Alaska-s-West-Coast-Network-to-Connect-With-American-s-Long-Haul-Flying-to-Create-More-Choice-for-T.html,0.2732,0.7456
AAL,2020-02-10,About 5% of US international flights may be impacted by coronavirus: Economist,https://cdn.snapi.dev/images/v1/m/q/about-5-of-us-international-flights-may-be-impacted-by-coronavirus-economist.jpg,CNBC Television,"CNBC's ""Power Lunch"" team discusses how the coronavirus outbreak is impacting travel with Hayley Berg, an economist at Hopper.",https://www.youtube.com/watch?v=id6voJuvCyc,0.0,0.0
AAL,2020-02-10,"Google Flights, increasingly dominant, sends ‘dramatic’ surge to American Airlines and Delta",https://cdn.snapi.dev/images/v1/u/j/p-1-google-flights-increasingly-dominant-sends-and8216dramaticand8217-surge-to-american-airlines-and-delta.jpg,Fast Company,The increase underscores the extent to which Google services are becoming further embedded into every aspect of the travel ecosphere.,https://www.fastcompany.com/90462440/google-flights-increasingly-dominant-sends-dramatic-surge-to-american-airlines-and-delta,0.0,0.3182
AAL,2020-02-10,Coronavirus spurs wave of US flight cancellations,https://cdn.snapi.dev/images/v1/r/f/rf211rggggg-1.jpg,Yahoo Finance,The coronavirus is striking a blow to U.S. airlines as they are forced to cancel flights amid decreased travel to and from China. Yahoo Finance's Seana Smith and Alexis Keenan discuss.,https://www.youtube.com/watch?v=WME-yx9O75c,0.0,-0.6124
AAL,2020-02-06,American Airlines Has A New Partner In South America,https://cdn.snapi.dev/images/v1/r/t/aa88.jpg,Seeking Alpha,American Airlines Has A New Partner In South America,https://seekingalpha.com/article/4321994-american-airlines-new-partner-in-south-america,0.0,0.0
AAL,2020-02-05,"Amazon, Nike, American Airlines: Tennessee anti-LGBT bills put 'economic success at risk'",https://cdn.snapi.dev/images/v1/y/g/106342694-1579285249619gettyimages-1147912747.jpeg,CNBC,"More than 100 companies, including Amazon, American Airlines, Salesforce, Mars and Nike, signed a letter saying anti-LGBT legislation in Tennessee is placing ""economic success at risk.""",https://www.cnbc.com/2020/02/05/amazon-nike-tennessee-anti-lgbt-bills-risk-economic-success.html,0.5106,0.6597
AAL,2020-02-04,Why Shares of American and Other Airlines Are Climbing Higher Today,https://cdn.snapi.dev/images/v1/c/2/urlhttps3a2f2fgfoolcdncom2feditorial2fimages2f5561932fairplane-airport-source-gettyjpgw700opresize.jpg,The Motley Fool,The stocks are gaining and losing altitude based on sentiment about the coronavirus.,https://www.fool.com/investing/2020/02/04/why-shares-of-american-airlines-and-other-airlines.aspx,0.296,0.0516
AAL,2020-02-04,"American Airlines: Legitimate Concerns, Undervalued Stock",https://cdn.snapi.dev/images/v1/j/w/airline9.jpg,Seeking Alpha,"American Airlines: Legitimate Concerns, Undervalued Stock",https://seekingalpha.com/article/4321341-american-airlines-legitimate-concerns-undervalued-stock,0.0,0.0
AAL,2020-02-04,American Airlines suspends Hong Kong flights amid coronavirus outbreak,https://cdn.snapi.dev/images/v1/6/u/106361504-1580305712626gettyimages-697885362.jpeg,CNBC,American Airlines has suspended its Hong Kong flights in addition to its mainland China service amid coronavirus outbreak.,https://www.cnbc.com/2020/02/04/coronavirus-american-airlines-suspends-hong-kong-flights-amid-outbreak.html,0.0,-0.4767
AAL,2020-02-04,"American Bulks Up At Miami, Signing With GOL To Counter Delta/LATAM",https://cdn.snapi.dev/images/v1/a/m/american-bulks-up-at-miami-signing-with-gol-to-counter-deltalatam.jpg,Forbes,"Now it is American Airlines that is bulking up its Miami operation, countering Delta expansion.",https://www.forbes.com/sites/tedreed/2020/02/04/american-bulks-up-at-miami-signing-with-gol-to-counter-deltalatam/,0.0,0.0
AAL,2020-02-04,American Airlines Q4 Earnings Could Signal a Turnaround,https://cdn.snapi.dev/images/v1/e/o/106137145-1568839235239gettyimages-1163604659.jpeg,The Motley Fool,The struggling airline seems to be making a comeback.,https://www.fool.com/investing/2020/02/04/american-airlines-q4-earnings-could-signal-a-turna.aspx,0.0,-0.4215
AAL,2020-02-04,American Airlines and GOL Announce Codeshare Agreement to Offer More Daily Service Between South America and the U.S. Than Any Other Airline Partnership,https://cdn.snapi.dev/images/v1/l/8/press3.jpg,GlobeNewsWire,American also increases service to MIA from six cities in the U.S.; adds second daily flight to Rio de Janeiro American also increases service to MIA from six cities in the U.S.; adds second daily flight to Rio de Janeiro,https://www.globenewswire.com/news-release/2020/02/04/1979322/0/en/American-Airlines-and-GOL-Announce-Codeshare-Agreement-to-Offer-More-Daily-Service-Between-South-America-and-the-U-S-Than-Any-Other-Airline-Partnership.html,0.4939,-0.7065
AAL,2020-02-03,"Start Planning For China Stimulus And A Virus ""Containment"" Relief Rally",https://cdn.snapi.dev/images/v1/e/9/etf32.jpg,Seeking Alpha,"Start Planning For China Stimulus And A Virus ""Containment"" Relief Rally",https://seekingalpha.com/article/4321009-start-planning-for-china-stimulus-and-virus-containment-relief-rally,0.4767,0.4767
AAL,2020-02-03,How the airline industry is weighing the risk of coronavirus,https://cdn.snapi.dev/images/v1/a/o/aoskw2q34-1.jpg,CNBC Television,"Gordon Bethune, former Continental Airlines CEO, and Dennis Tajer, spokesman for American Airlines' pilots union, join ""Squawk Box"" to discuss the impact the coronavirus is having on the airline industry.",https://www.youtube.com/watch?v=45ZLIZpqZi0,-0.2732,0.296
AAL,2020-02-03,Major US airlines expand flight cancellations to China and Hong Kong,https://cdn.snapi.dev/images/v1/2/0/200201121610-delta-airlines-beijing-file-super-169.jpg,CNN Business,American Airlines and Delta Air Lines announced more flight cancellations to China on Saturday as coronavirus cases rise rapidly.,https://www.cnn.com/2020/02/01/business/american-delta-airlines-coronavirus/index.html,0.3182,0.0
AAL,2020-01-31,Airline stocks dip as flights in and out of China canceled,https://cdn.snapi.dev/images/v1/g/r/gr54gggg-1.jpg,CNBC Television,CNBC's Phil LeBeau takes a look at how the coronavirus is weighing on popular airlines.,https://www.youtube.com/watch?v=MPeYzrc_Rwg,0.0,0.4215
AAL,2020-01-31,Coronavirus: These 7 Airlines Have Suspended All Flights to China,https://cdn.snapi.dev/images/v1/q/l/airline3.jpg,Zacks Investment Research,"The coronavirus outbreak is beginning to seriously impact travel, and now, seven major airlines have suspended all routes to China.",https://www.zacks.com/stock/news/743182/coronavirus-these-7-airlines-have-suspended-all-flights-to-china,-0.4767,-0.5859
AAL,2020-01-31,"Delta, American airlines halt flights to China amid coronavirus outbreak",https://cdn.snapi.dev/images/v1/s/l/coronavirus-flight-67jpgquality90stripall.jpg,New York Post,"The two largest US airlines plan to suspend all flights to China amid the country’s mushrooming coronavirus crisis. American Airlines is halting trips to and from mainland China on Friday because of the outbreak that has so far killed 213 people, the company said.",https://nypost.com/2020/01/31/delta-american-airlines-halt-flights-to-china-amid-coronavirus-outbreak/,0.0,-0.9038
AAL,2020-01-31,"American, Delta and United airlines suspend most US- China flights amid coronavirus outbreak",https://cdn.snapi.dev/images/v1/1/4/200131105507-delta-airlines-planes-tarmac-super-169.jpg,CNN Business,"Three of the largest US airlines -- Delta, American and United -- have canceled more flights between the United States and China because of concerns about the spread of coronavirus.",https://www.cnn.com/2020/01/31/business/american-delta-united-flights-coronavirus/index.html,0.128,0.6808
AAL,2020-01-31,"Delta, American suspend all U.S.-China flights",https://cdn.snapi.dev/images/v1/h/z/106271527-1575057401731gettyimages-1185038297.jpeg,Reuters,Delta Air Lines Inc and American Airlines Group Inc decided on Friday to temporarily suspend all remaining U.S.-China flights after the U.S.,https://www.reuters.com/article/us-china-health-delta-air/delta-american-suspend-all-u-s-china-flights-idUSKBN1ZU25I,-0.3182,-0.3182
AAL,2020-01-31,American Airlines to suspend all US-China flights,https://cdn.snapi.dev/images/v1/m/7/american-airlines-to-suspend-all-us-china-flights.jpg,CNBC Television,CNBC's Phil LeBeau reports on American Airlines suspending all U.S.,https://www.youtube.com/watch?v=x2KMaQcE85Q,-0.3182,0.0
AAL,2020-01-31,Allied Pilots Association spokesman Dennis Tajer on pilots' lawsuit against American Airlines,https://cdn.snapi.dev/images/v1/m/z/allied-pilots-association-spokesman-dennis-tajer-on-pilots-lawsuit-against-american-airlines.jpg,CNBC Television,"Dennis Tajer, pilot and communications committee chairman for the Allied Pilots Association, weighs in on American Airlines pilots' decision to file suit against the firm to halt flights to China.",https://www.youtube.com/watch?v=XiFkvfFG5iY,-0.2263,0.0
AAL,2020-01-30,American Airlines and TWU-IAM Association Reach Tentative Agreements for Joint Collective Bargaining Agreements,https://cdn.snapi.dev/images/v1/l/g/press4-2.jpg,GlobeNewsWire,"FORT WORTH, Texas, Jan.  30, 2020  (GLOBE NEWSWIRE) -- American Airlines and the TWU-IAM Association reached tentative agreements this week for new joint collective bargaining agreements that cover more than 31,000 team members.",https://www.globenewswire.com/news-release/2020/01/31/1977889/0/en/American-Airlines-and-TWU-IAM-Association-Reach-Tentative-Agreements-for-Joint-Collective-Bargaining-Agreements.html,0.5106,0.7378
AAL,2020-01-30,American Airlines Reaches $4.2 Billion Deal With Mechanics And Fleet Service,https://cdn.snapi.dev/images/v1/b/r/american-airlines-reaches-42-billion-deal-with-mechanics-and-fleet-service.jpg,Forbes,"After four years of negotiations, American Airlines has reached a tentative contract agreement with the unions representing its mechanics and fleet service workers.",https://www.forbes.com/sites/tedreed/2020/01/30/american-airlines-reaches--42-billion-deal-with-mechanics-and-fleet-service/,0.0516,0.5574
AAL,2020-01-30,American Airlines pilots sue to halt China flights amid coronavirus crisis,https://cdn.snapi.dev/images/v1/s/0/200130-american-airlines-pilots-china-suitjpgquality90stripall.jpg,New York Post,"DALLAS — The pilots’ union at American Airlines sued on Thursday to stop the carrier from flying to China and told members not to operate flights there because of the spreading coronavirus outbreak. The Allied Pilots Association, which represents American’s 15,000 pilots, asked a state district court in Dallas for an injunction to halt the.",https://nypost.com/2020/01/30/american-airlines-pilots-sue-to-halt-china-flights-amid-coronavirus-crisis/,-0.6249,-0.296
AAL,2020-01-30,American Airlines pilots sue to block China flights as virus unnerves crew worldwide,https://cdn.snapi.dev/images/v1/g/f/m02d20200130t2i1483666603rlynxmpeg0t299w640.jpg,Reuters,"A pilots union filed a lawsuit on Thursday seeking to immediately halt American Airlines U.S.-China service,  as cabin crews worldwide voiced unease about exposure to the rapidly-spreading coronavirus which has killed more than 170 people in China.",https://www.reuters.com/article/us-china-health-airlines/american-airlines-pilots-sue-to-block-china-flights-as-virus-unnerves-crew-worldwide-idUSKBN1ZT33W,-0.4404,-0.8442
AAL,2020-01-30,American Airlines pilots file suit against firm to halt China flights,https://cdn.snapi.dev/images/v1/g/w/american-airlines-pilots-file-suit-against-firm-to-halt-china-flights.jpg,CNBC Television,American Airlines pilots file suit against the firm to halt all flights to China.,https://www.youtube.com/watch?v=cpTCOW0m0g4,0.0,0.0
AAL,2020-01-30,Berenberg: It's fair to assume airlines will see a recovery once the risk of virus contagion subside,https://cdn.snapi.dev/images/v1/m/q/berenberg-its-fair-to-assume-airlines-will-see-a-recovery-once-the-risk-of-virus-contagion-subside.jpg,CNBC Television,"Adrian Yanoshik of Berenberg discusses the impact the coronavirus is having on global airlines, especially those with large route maps in Asia.",https://www.youtube.com/watch?v=qN7e73GvwV0,-0.4215,0.0
AAL,2020-01-29,Why American Airlines Could Have Investment Potential,https://cdn.snapi.dev/images/v1/z/z/105956874-1560091640851rtx6w9s6.jpg,GuruFocus,American Airlines Group Inc. (NASDAQ:AAL) could deliver a successful share price turnaround following its 26% decline over the past year.,https://www.gurufocus.com/news/1024013/why-american-airlines-could-have-investment-potential,0.0,0.7184
AAL,2020-01-29,3 Airline Stocks to Sell This Week in Wake of the Coronavirus,https://cdn.snapi.dev/images/v1/a/i/airlines1600a-min-768x432-2.jpg,InvestorPlace,"With the coronavirus on consumers' minds, along with continued issues with the 737 Max grounding, these three airline stocks could go lower.",https://investorplace.com/2020/01/3-airline-stocks-to-sell-coronavirus/,0.0,-0.296
AAL,2020-01-29,American Airlines suspends two routes to China as coronavirus spreads,https://cdn.snapi.dev/images/v1/p/i/200129100624-los-angeles-airport-american-airlines-file-super-169.jpg,CNN Business,American Airlines is the second US carrier to suspend some of its flights to China as the deadly coronavirus continues to spread and shrinks demand.,https://www.cnn.com/2020/01/29/business/american-airlines-suspends-china-flights-coronavirus/index.html,0.0,-0.4215
AAL,2020-01-29,American Airlines cancels some flights from LAX to Beijing and Shanghai starting on February 9,https://cdn.snapi.dev/images/v1/c/h/american-airlines-cancels-some-flights-from-lax-to-beijing-and-shanghai-starting-on-february-9.jpg,CNBC Television,CNBC's Phil LeBeau reports on American Airlines' decision to cancel flights from LAX to Beijing and Shanghai starting in February.,https://www.youtube.com/watch?v=KBtcagSIa48,-0.2263,-0.25
AAL,2020-01-29,American Airlines cancels some China service for more than a month as coronavirus spreads,https://cdn.snapi.dev/images/v1/x/a/106361504-1580305712626gettyimages-697885362.jpeg,CNBC,American Airlines joined United in cutting some China flights as the coronavirus spreads and the government increased its travel warning.,https://www.cnbc.com/2020/01/29/coronavirus-american-airlines-reduces-china-service-as-outbreak-grows.html,-0.2263,0.25
AAL,2020-01-29,China has been a tough market for airlines before coronavirus: Kaplan Research principal,https://cdn.snapi.dev/images/v1/m/q/china-has-been-a-tough-market-for-airlines-before-coronavirus-kaplan-research-principal.jpg,CNBC Television,"Seth Kaplan, Kaplan Research principal, joins 'Squawk Box' to discuss which airlines are most at risk from the ongoing coronavirus outbreak.",https://www.youtube.com/watch?v=tnMJpmR2R-k,-0.128,-0.3353
