symbol,publishedDate,title,image,site,text,url,title_compound,text_compound
AAL,2020-08-05,"Wall Street Rallies as Bulls Feast on Stimulus, Vaccine Optimism",https://i-invdn-com.akamaized.net/news/LYNXNPEAAJ0W3_L.jpg,investing,"Wall Street Rallies as Bulls Feast on Stimulus, Vaccine Optimism",https://www.investing.com/news/stock-market-news/wall-street-rallies-as-bulls-feast-on-stimulus-vaccine-optimism-2255188,0.5423,0.5423
AAL,2020-08-04,"American, pilots agree on steps aimed at reducing job cuts",https://i.dailymail.co.uk/1s/2020/08/05/00/wire-31571484-1596583679-540_636x382.jpg,https://www.dailymail.co.uk,American Airlines has reached a deal with its pilots´ union designed to reduce the number of job losses in October as the airline shrinks because fewer...,https://www.dailymail.co.uk/wires/ap/article-8593937/American-pilots-agree-steps-aimed-reducing-job-cuts.html,0.0772,-0.25
AAL,2020-08-04,"American, pilots agree on steps aimed at reducing job cuts",https://s.hdnux.com/photos/01/13/05/45/19683673/5/rawImage.jpg,https://www.newstimes.com,"American Airlines has reached a deal with its pilots' union designed to reduce the number of job losses in October as the airline shrinks because fewer people are flying during the pandemic. 
 American had previously offered early retirement to pilots and other employees. But, Senior Vice President Kimball Stone said Tuesday, ""we still had many more people than necessary to run our operation."" 
 The agreement with the Allied Pilots Association would let pilots work every other month through next May, or take leave while receiving training so they could be rehired if travel demand recovers. 
 It is the latest among a number of deals negotiated by airlines and their unions to limit or avoid job cuts in October. That is when federal relief for airline labor costs and a ban on layoffs end. Congress is considering giving passenger airlines another $25 billion to avoid layoffs shortly before the Nov. 3 election. 
 Last month, American, which is based in Fort Worth, Texas, warned 25,000 employees, including about 2,500 pilots, that they could be furloughed, or laid off with rehiring rights. More than 800 American pilots took early retirement. 
 Delta Air Lines, which sent furlough warnings to more than 2,500 pilots, got 2,200 to take early retirement. United Airlines warned 36,000 employees that they could lose their jobs. 
 A hoped-for recovery in air travel leveled off in June and July as the number of coronavirus cases in the U.S. surged. Passenger traffic is down more than 70% from a year ago.",https://www.newstimes.com/business/article/American-pilots-agree-on-steps-aimed-at-reducing-15458934.php,0.0772,-0.7184
AAL,2020-08-04,Activist wearing 'F--- 12' mask removed from American Airlines flight,https://thehill.com/sites/default/files/ca_americanairlines_042820getty.jpg,https://thehill.com,"A Florida woman is claiming that she was kicked off an American Airlines flight ""because I'm black"" after flight crew directed her to depart the airplane following a warning not to wear a face mask with an anti-police message.",https://thehill.com/policy/transportation/510528-activist-wearing-mask-with-offensive-language-removed-from-american,0.0,-0.34
AAL,2020-08-04,Winners and Losers Are Emerging in Airline Stocks,https://images.barrons.com/im-216813/social,barrons,"With demand looking weaker, investors want to see airlines cut costs dramatically. Carriers that do so may be rewarded with higher share prices.",https://www.barrons.com/articles/winners-and-losers-are-emerging-in-airline-stocks-51596559300,-0.0772,0.1189
AAL,2020-08-04,9 Top Robinhood Stocks You May Want to Avoid Here,https://investorplace.com/wp-content/uploads/2019/10/robinhood1600.jpg,https://investorplace.com,Many Robinhood stocks have soared as money flooded in at March lows. But the platform's investors have these nine names wrong.,https://investorplace.com/2020/08/9-top-robinhood-stocks-you-may-want-to-avoid/,-0.0258,-0.5994
AAL,2020-08-04,"CIBC Asset Management Inc Sells 25,439 Shares of American Airlines Group Inc (NASDAQ:AAL)",https://www.marketbeat.com/logos/american-airlines-group-logo.jpg,https://www.thelincolnianonline.com,"CIBC Asset Management Inc trimmed its holdings in shares of American Airlines Group Inc (NASDAQ:AAL) by 41.9% in the second quarter, according to the company in its most recent Form 13F filing with the Securities and Exchange Commission (SEC). The fund owned 35,215 shares of the airline’s stock after selling 25,439 shares during the period. […]",https://www.thelincolnianonline.com/2020/08/04/cibc-asset-management-inc-sells-25439-shares-of-american-airlines-group-inc-nasdaqaal.html,0.5719,0.8519
AAL,2020-08-04,This CEO has flown 33 times and spent 160 nights away this year. Here's his safety routine,https://image.cnbcfm.com/api/v1/image/106644488-1596445598651-gettyimages-1216315312-img_7870.jpeg?v=1596446339,cnbc,"This business traveler has taken 33 flights and spent 160 nights in hotels in 2020 has been on the road for approximately 75% of 2020. To avoid contracting the coronavirus, he has adopted a specific regimen to staying safe on airplanes, in airports and in hotels. This what he does.",https://www.cnbc.com/2020/08/04/how-to-stay-safe-while-flying-and-staying-in-hotels-during-a-pandemic.html,0.4215,0.1779
AAL,2020-08-03,The Boeing 737 MAX Can Generate Cash for Airlines In Unexpected Ways,https://images.barrons.com/im-216356/social,barrons,The German tourism company TUI is saving money by selling Boeing 737 MAX jets and leasing them back.,https://www.barrons.com/articles/tui-enters-sale-and-leaseback-deal-for-boeing-737-max-jets-51596482128,0.0,0.0
AAL,2020-08-03,Airlines stocks reverse higher after TSA data shows bounce in traveler demand to snap a 2-week dip,https://s.wsj.net/public/resources/MWimages/MW-GP644_MicroS_ZG_20180906154215.jpg,marketwatch,"Airline stocks turned mostly higher Monday, after U.S. Transportation Security Administration (TSA) showed that travel demand rebounded, to snap a two-week...",https://www.marketwatch.com/story/airlines-stocks-reverse-higher-after-tsa-data-shows-bounce-in-traveler-demand-to-snap-a-2-week-dip-2020-08-03,-0.128,0.2263
AAL,2020-08-03,Analysts Are on the Fence About American Airlines Stock,https://investorplace.com/wp-content/uploads/2020/03/americanairlines.jpg,https://investorplace.com,Citigroup analysts recently cut American Airlines’ target price by $3 to $11. It seems I’m not the only one avoiding AAL stock.,https://investorplace.com/2020/08/aal-stock-analysts-are-on-the-fence-about-american-airlines/,0.0,-0.5423
AAL,2020-08-03,"Airlines, unions push for billions in additional federal aid to save airline jobs as layoffs loom",https://image.cnbcfm.com/api/v1/image/106568667-1591570224244gettyimages-1212813167.jpeg?v=1596464254,cnbc,Airlines and unions are pushing for additional federal aid as a recovery in demand remains remote.,https://www.cnbc.com/2020/08/03/airlines-unions-push-for-billions-in-additional-federal-aid-to-save-airline-jobs-as-loom.html,0.3182,-0.128
AAL,2020-08-03,Here Are the Top 10 Most Popular Stocks on Robinhood | The Motley Fool,https://g.foolcdn.com/editorial/images/585399/invest-gettyimages-469578039.jpg,https://www.fool.com,And the two best stocks to buy right now.,https://www.fool.com/investing/2020/08/03/here-are-the-top-10-most-popular-stocks-on-robinho.aspx,0.2484,0.6369
AAL,2020-08-03,American Airlines Group Inc (NASDAQ:AAL) Shares Bought by Cambridge Investment Research Advisors Inc.,https://www.marketbeat.com/logos/american-airlines-group-logo.jpg,https://www.thelincolnianonline.com,"Cambridge Investment Research Advisors Inc. grew its holdings in shares of American Airlines Group Inc (NASDAQ:AAL) by 125.3% during the second quarter, according to its most recent Form 13F filing with the SEC. The firm owned 192,632 shares of the airline’s stock after purchasing an additional 107,130 shares during the period. Cambridge Investment Research Advisors […]",https://www.thelincolnianonline.com/2020/08/03/american-airlines-group-inc-nasdaqaal-shares-bought-by-cambridge-investment-research-advisors-inc.html,0.296,0.6808
AAL,2020-08-03,American Airlines now showing Apple TV+ shows on flights | Cult of Mac,https://cdn.cultofmac.com/wp-content/uploads/2019/09/Apple-TV.jpg,https://www.cultofmac.com,American Airlines has come to an agreement with Apple to show Apple TV+ shows on its flights. They are show 10 shows for free.,https://www.cultofmac.com/718989/american-airlines-now-showing-apple-tv-shows-on-flights/,0.0,0.7579
AAL,2020-08-03,Texas company looks to unload 42 excess tons of airline nuts,https://s.hdnux.com/photos/01/13/25/45/19749192/8/rawImage.jpg,https://www.newstimes.com,"DALLAS (AP) - Kim Peacock was once the purveyor of first-class luxury, but now her Arlington company has more than 87,000 pounds of nuts and no idea if her airline customers will ever want them again. 
 So GNS Foods of Arlington, a supplier to American Airlines, is trying to unload dozens of pallets of mixed cashews, pistachios, pecans and almonds after the COVID-19 pandemic forced carriers to stop serving the first-class perk on flights. 
 GNS opened a retail store at its factory and started peddling nuts online in hopes of getting rid of them at their wholesale price, even though the company took the effort to roast, salt and package the nuts. 
 ""We have pallets and pallets of nuts here,"" Peacock told The Dallas Mornings News. ""We didn't know how long this was going to last. The airlines were in a state of disarray themselves and they didn't know if they were going to be bringing them back or not."" 
 The company still has about 70,000 bags that weigh 1.25 pounds a piece. 
 First-class nuts have been one of the surprise victims of the global COVID-19 pandemic, which has overtaken all aspects of life and sent airlines into a frenzy of how to protect customers and avoid bankruptcy. 
 American Airlines stopped serving warm nuts and most other food items to passengers in March, when the COVID-19 pandemic started and airlines were on the front lines of battling the spread of the virus. Now flight attendants pass out a paper bag with a small bottled water, pre-packaged snacks and hand sanitizer. High-profit-margin alcohol sales are offered only on longer-haul flights and only to premium-class customers. 
 American Airlines has had to find ways to unload its excess food, too. The Fort Worth-based carrier has donated about 500,000 pounds to food banks nationwide, including...",https://www.newstimes.com/news/article/Texas-company-looks-to-unload-42-excess-tons-of-15449961.php,-0.3182,-0.9688
AAL,2020-08-03,American Airlines offering Apple TV+ shows as free in-flight entertainment - 9to5Mac,https://9to5mac.com/wp-content/uploads/sites/6/2020/08/apple-tv-plus-american-airlines.jpg?quality=82&strip=all,https://9to5mac.com,"Apple TV+ is now available on American Airlines for free. The airline and Apple are partnering to give customers more options for passing the time whilst in the air. As first reported by The Points Guy, Apple TV+ content is now available on American Airline entertainment systems. The exact roster of shows varies per flight, […]",https://9to5mac.com/2020/08/02/american-airlines-apple-tv-plus/,0.7269,0.7269
AAL,2020-08-03,"Airlines, unions pin hopes for more payroll cash on politics",https://s.abcnews.com/images/Travel/WireAP_f30edf2694a44038a92ad8469962364e_16x9_992.jpg,abcnews,Unions are gaining support in Congress for another $32 billion in federal aid to protect airline workers from layoffs for another six months,https://abcnews.go.com/Business/wireStory/airlines-unions-pin-hopes-payroll-cash-politics-72118839,0.4215,0.7964
AAL,2020-08-03,Robinhood Investors Are Betting on a Travel Stock Recovery -- Should You? | The Motley Fool,https://g.foolcdn.com/editorial/images/584718/gettyimages-512627676.jpg,https://www.fool.com,Some investors expect great share gains to eventually replace devastating losses.,https://www.fool.com/investing/2020/08/01/robinhood-investors-are-betting-on-a-travel-stock.aspx,-0.4404,0.1779
AAL,2020-08-03,Allegiant Flies Above the Pack With Its Budget-Meets-Leisure Formula,https://images.barrons.com/im-215602/social,barrons,"In a year in which airlines have gotten hammered by the pandemic, a carrier with ultralow costs and flexible scheduling takes the lead. Not that the flight may not get a little rough.",https://www.barrons.com/articles/allegiant-travel-where-budget-meets-leisure-51596242250,0.0,0.2263
AAL,2020-07-31,Bankruptcy Risks Mount for Embattled American Airlines,https://investorplace.com/wp-content/uploads/2019/07/aal1600.jpg,https://investorplace.com,"AAL stock is taking a beating because management has decided to pile on debt and run unprofitable routes, leading to bankruptcy risks.",https://investorplace.com/2020/07/aal-stock-bankruptcy-risks-mount-american-airlines/,-0.2732,-0.765
AAL,2020-07-30,UPS Pilots Seek Option To Refuse Hong Kong Missions,https://cdn.benzinga.com/files/imagecache/og_image_social_share_1200x630/images/story/2012/ups-hong-kong-opt-out.jpg,benzinga,"The union representing United Parce Service, Inc. (NYSE: UPS) pilots has asked the express and freight delivery giant for the option to decline flight assignments to Hong Kong...",https://www.benzinga.com/news/20/07/16852162/ups-pilots-seek-option-to-refuse-hong-kong-missions,-0.296,0.4215
AAL,2020-07-29,American Airlines: Negative Obsession,https://static2.seekingalpha.com/uploads/2020/7/28/234751-15959880360774865.png,seekingalpha.com,The market is too obsessed with total debt at American Airlines. The airline has substantial cash balances and equipment assets to offset the debt levels.,https://seekingalpha.com/article/4361881-american-airlines-negative-obsession,-0.7269,-0.4939
AAL,2020-07-29,American Airlines Can't Shrink Its Way Out Of Strategic Failures,https://static.seekingalpha.com/uploads/2020/7/28/7197781-15959741072378187.png,seekingalpha.com,The airline industry has shifted from cash management to network strategies in the COVID-19 environment.,https://seekingalpha.com/article/4361838-american-airlines-cant-shrink-way-out-of-strategic-failures,-0.4588,0.0
AAL,2020-07-28,Pro-Trump activist holds up flight refusing to wear mask,https://mediadc.brightspotcdn.com/dims4/default/781d520/2147483647/strip/true/crop/3270x1717+0+93/resize/1200x630!/quality/90/?url=https%3A%2F%2Fmediadc.brightspotcdn.com%2F91%2Fae%2Fcf978d87726372650deae8262f32%2Fd1e040997c627b9dd92865bdd874103d.jpg,https://www.washingtonexaminer.com,"A Pro-Trump activist held up an American Airlines flight over the weekend as he laughed in a social media video over refusing to wear a mask, claiming he had a medical condition.",https://www.washingtonexaminer.com/news/pro-trump-activist-holds-up-flight-refusing-to-wear-mask,-0.4019,0.0772
AAL,2020-07-28,Southwest Airlines: The Most Defensive Airline,https://static.seekingalpha.com/uploads/2020/7/24/saupload_F500-2020-141-Southwest-Airlines_thumb1.jpg,seekingalpha.com,"Despite grim outlook by IATA, traveler throughput is seeing gradual week over week increases. According to my breakeven analysis, Southwest is expected to breakeven in Q4 2021.",https://seekingalpha.com/article/4361251-southwest-airlines-defensive-airline,0.101,0.4585
AAL,2020-07-28,Option Trading Volume Higher Than Underlying Stock Volume For First Time Ever,https://cdn.benzinga.com/files/imagecache/og_image_social_share_1200x630/images/story/2012/entrepreneur-4313671_1920.jpg,benzinga,"This year has been a year of firsts on Wall Street, and the options market is the latest to register an unprecedented surge in popularity.
Goldman Sachs has reported that single...",https://www.benzinga.com/analyst-ratings/analyst-color/20/07/16809115/option-trading-volume-higher-than-underlying-stock-volume-for-first-time-ever,0.0,0.4767
AAL,2020-07-27,Majority of U.S. House backs new bailout for U.S. passenger airlines,https://image.cnbcfm.com/api/v1/image/106470198-1585753252525gettyimages-1208433245.jpeg?v=1585753347,cnbc,A majority U.S. House of Representatives lawmakers signed a letter made public on Monday calling for a six-month extension of a $32 billion payroll aid program that they argue is crucial to keeping hundreds of thousands of aviation workers employed through March 31.,https://www.cnbc.com/2020/07/27/majority-of-us-house-backs-new-bailout-for-us-passenger-airlines.html,-0.1531,-0.34
AAL,2020-07-27,"Cruise and airline stocks fall to buck the broader market rally as COVID-19 cases, deaths keep surging",https://s.wsj.net/public/resources/MWimages/MW-GP644_MicroS_ZG_20180906154215.jpg,marketwatch,"While the broader stock market continues to rise amid optimism over potential COVID-19 vaccines and additional government stimulus measures, cruise and...",https://www.marketwatch.com/story/cruise-and-airline-stocks-fall-to-buck-the-broader-market-rally-as-covid-19-cases-deaths-keep-surging-2020-07-27,0.0,0.5423
AAL,2020-07-27,American Airlines Gets an Upgrade as Carriers Cut Flight Schedules,https://images.barrons.com/im-213546/social,barrons,"While the airline’s debt burden remains a concern, a Raymond James analyst writes that bankruptcy is not in the cards.",https://www.barrons.com/articles/american-airlines-stock-gets-an-upgrade-51595863715,-0.2732,-0.6597
AAL,2020-07-27,"Coronavirus update: U.S. case tally climbs above 4.2 million after a fifth straight day of more than 1,000 new infections",https://s.marketwatch.com/public/resources/images/MW-IL231_VirusB_ZG_20200727104749.jpg,marketwatch,"The U.S. case tally for the coronavirus illness COVID-19 rose above 4.2 million on Monday, after a fifth straight day of more than 1,000 new infections, as...",https://www.marketwatch.com/story/coronavirus-update-us-case-tally-climbs-above-42-million-after-a-fifth-straight-day-of-more-than-1000-new-infections-2020-07-27,0.2263,-0.2023
AAL,2020-07-27,Safety and customer service: Which airlines are doing best?,https://s.marketwatch.com/public/resources/images/MW-IK995_nerd_a_ZG_20200722163216.jpg,marketwatch,"Challenged with balancing customer service and dwindling revenue, some have fallen back on their worst corporate habits.",https://www.marketwatch.com/story/safety-and-customer-service-which-airlines-are-doing-best-2020-07-27,0.7906,-0.7906
AAL,2020-07-27,The ODP Corporation Appoints Wendy Schoppert to Company’s Board of Directors,https://mms.businesswire.com/media/20200727005779/en/808462/23/ODP_Wht.jpg,businesswire,The ODP Corporation appoints Wendy Schoppert to the company's Board of Directors.,https://www.businesswire.com/news/home/20200727005779/en/ODP-Corporation-Appoints-Wendy-Schoppert-Company%E2%80%99s-Board,0.0,0.0
AAL,2020-07-27,American Airlines (AAL) expects protracted recovery in air travel demand | AlphaStreet,https://cdn.news.alphastreet.com/wp-content/uploads/2020/07/American-Airlines-Q2-2020-Earnings-Infographic-608x1024.jpg,https://news.alphastreet.com,"Last week, many airline carriers reported their quarterly earnings and American Airlines Group (NASDAQ: AAL) was one among them.",https://news.alphastreet.com/american-airlines-aal-q2-2020-earnings-forecasts-protracted-recovery-in-air-travel-demand/,-0.128,0.0
AAL,2020-07-27,Here are five charts illustrating U.S. economic trends amid the coronavirus pandemic,https://image.cnbcfm.com/api/v1/image/106631376-1595599624468-20200724seven_day_average_apple.png?v=1595599642,cnbc,These five charts illustrate trends in important industries that help track reopening progress in the U.S. amid the coronavirus pandemic.,https://www.cnbc.com/2020/07/26/coronavirus-5-charts-illustrating-us-economic-trends.html,0.0,0.743
AAL,2020-07-27,3 Top Robinhood Stocks You Shouldn't Even Consider Buying | The Motley Fool,https://g.foolcdn.com/editorial/images/583509/investor-checking-stocks-on-his-phone.jpg,https://www.fool.com,"Unless you love risk, you probably won't want to invest in these stocks that are hot among millennial investors.",https://www.fool.com/investing/2020/07/26/3-top-robinhood-stocks-you-shouldnt-even-consider.aspx,-0.2732,0.4363
AAL,2020-07-27,Industry Analysis: Airlines,https://static2.seekingalpha.com/uploads/2020/7/372226_15957142294711_rId6_thumb.jpg,seekingalpha.com,Affects of the CV (Covid-19 or SARS-Cov2) pandemic so far and going forward. Major Airline Comparisons Sustainable demand recovery not likely for another 3 years.,https://seekingalpha.com/article/4360837-industry-analysis-airlines,0.0,-0.128
AAL,2020-07-27,"Schlumberger slashes 21,000 jobs amid pandemic oil rout",https://s.abcnews.com/images/US/WireAP_6be51ce4a1f742e4b235b60772c2c4af_16x9_992.jpg,abcnews,"Schlumberger is cutting more than 21,000 jobs as the global coronavirus pandemic quashes demand for energy and oil prices are routed",https://abcnews.go.com/Business/wireStory/schlumberger-slashes-21000-jobs-amid-pandemic-oil-rout-71964378,-0.2023,0.0258
AAL,2020-07-27,'Make Or Break': Stock Market Update For The Week Ahead,https://cdn.benzinga.com/files/imagecache/og_image_social_share_1200x630/images/story/2012/american-and-chinese-flags-and-usa-dollars-4386371_0.jpg,benzinga,"The Last Week, In A Nutshell
What Happened: Stocks closed the week lower on an escalation of U.S. and China tensions, mixed reactions to earnings results, and delays in stimulus...",https://www.benzinga.com/news/earnings/20/07/16782078/make-or-break-stock-market-update-for-the-week-ahead,0.0,-0.5994
AAL,2020-07-27,Airlines Had a Terrible Quarter. Here’s What Could Be Next for Their Stocks.,https://images.barrons.com/im-212864/social,barrons,A recovery for carriers stalled in July as coronavirus cases rose and states imposed quarantine measures.,https://www.barrons.com/articles/airline-s-had-a-bad-quarter-analysts-look-at-what-comes-next-51595605403,-0.4767,-0.2732
AAL,2020-07-24,Passengers cheer as ‘Karen’ is kicked off flight for refusing to wear mask,https://nypost.com/wp-content/uploads/sites/2/2020/07/karen-flight-01.jpg?quality=90&strip=all&w=1200,https://nypost.com,"Passengers on an America Airlines flight burst into applause when a woman who refused to wear a face mask was kicked off the plane, according to video footage and a report. Passenger Jordan Slade f…",https://nypost.com/2020/07/24/cheers-erupt-as-karen-kicked-off-plane-for-not-wearing-mask/,0.1531,0.1531
AAL,2020-07-24,Airlines Had a Terrible Quarter. Here’s What Could Be Next for Their Stocks.,https://images.barrons.com/im-212864/?size=1.5,marketwatch,A recovery for carriers stalled in July as coronavirus cases rose and states imposed quarantine measures.,https://www.marketwatch.com/articles/airline-s-had-a-bad-quarter-analysts-look-at-what-comes-next-51595605403,-0.4767,-0.2732
AAL,2020-07-24,FAA warns of possible engine shutdowns in safety directive on older Boeing 737 jets,https://image.cnbcfm.com/api/v1/image/106631314-1595597100414-gettyimages-973305664-1037_40_av21101313.jpeg?v=1595597246,cnbc,The FAA is warning airlines to inspect some older 737 jets that have been in storage for potential corrosion that could cause engine shutdowns.,https://www.cnbc.com/2020/07/24/faa-warns-of-possible-engine-shutdowns-in-safety-directive-on-older-boeing-737-jets.html,0.34,-0.34
AAL,2020-07-24,"Today’s Logistics Report: Amazon’s Investing Strategy; Bending Metal Tariffs; Retooling
               Supply Chains",https://images.wsj.net/im-212855/social,wsj,Today’s Top Supply Chain & Logistics News from WSJ.,https://www.wsj.com/articles/todays-logistics-report-amazons-investing-strategy-bending-metal-tariffs-retooling-supply-chains-11595597367,0.0,0.2023
AAL,2020-07-24,American Airlines Einnahmen sinken im zweiten Quartal um 86% | Invezz,https://invezz.com/wp-content/uploads/2020/07/american-airlines-july-23.jpg,https://invezz.com,"American Airlines (NASDAQ: AAL) gab am Donnerstag bekannt, im zweiten Quartal des Finanzjahres einen Verlust von 1,65 Mrd. Pfund gemacht zu haben. Das Unternehmen führte seine schwache Leistung auf den wirtschaftlichen Schlag von COVID-19 zurück, der die Nachfrage nach Flugreisen in den letzten Monaten fast zum Erliegen brachte. Sein Konkurrent, Southwest Airlines, meldete am Donnerstag ebenfalls einen Verlust von 720 Mio. Pfund im zweiten Quartal. Die Aktien des Unternehmens wurden am Donnerstag im vorbörslichen Handel um 0,5% höher gehandelt. Mit 8,93 Pfund pro Aktie liegt American Airlines auf dem Aktienmarkt bisher etwa 60% unter dem Vorjahresniveau, nachdem es sich von",https://invezz.com/de/news/2020/07/24/american-airlines-einnahmen-sinken-im-zweiten-quartal-um-86/,0.0,-0.8316
AAL,2020-07-24,Airlines confirm fears that travel demand dropped as new COVID-19 cases rose again in July,https://s.marketwatch.com/public/resources/images/MW-IJ713_airlin_ZG_20200701195247.jpg,marketwatch,"Several airlines have confirmed what many have feared, that the recent spike in COVID-19 cases in many U.S. states has caused consumers to rethink their...",https://www.marketwatch.com/story/airlines-confirm-fears-that-travel-demand-dropped-as-new-covid-19-cases-rose-again-in-july-2020-07-23,-0.5106,-0.4939
AAL,2020-07-24,Alaska Airlines to join oneworld - Rus Tourism News,https://www.rustourismnews.com/wp-content/uploads/2019/09/Alaska-Airlines.jpg,https://www.rustourismnews.com,"Alaska Airlines is to join oneworld, becoming the alliance’s 14th member airline and bringing even more destinations and flights to customers.",https://www.rustourismnews.com/2020/07/24/alaska-airlines-to-join-oneworld-2/,0.296,0.296
